{
  "schemaVersion": 1,
  "id": "sambu-ukraine-2023",
  "subject": "삼부토건",
  "instruments": [
    { "code": "001470", "name": "삼부토건" },
    { "code": "219550", "name": "디와이디" }
  ],
  "aliases": ["이일준", "이응근", "이기훈", "정창래", "신규철", "DYD"],
  "topics": ["우크라이나 재건", "재건 포럼", "이르핀", "업무협약", "MOU", "김건희 특검", "사기적 부정거래", "369억원", "공판"],
  "speaker": "이일준 회장·이응근 전 대표·이기훈 전 부회장·정창래 씨·신규철 경영지원본부장과 디와이디 법인 (특검 공소 기준)",
  "audience": "우크라이나 재건 사업 홍보를 보고 삼부토건 주식을 산 투자자",
  "title": "삼부토건 경영진, 우크라이나 재건 홍보 뒤 매도",
  "headline": [
    "특검은 삼부토건 경영진이 역량 없이 우크라이나 재건 사업을 추진하는 것처럼 홍보해 주가를 올린 뒤 주식을 팔아 369억원을 얻었다고 기소했습니다.",
    "2023년 5월 재건 포럼 MOU 홍보 뒤 1000원대 주가가 두 달 만에 5500원까지 올랐고, 피고인 대부분은 혐의를 부인합니다."
  ],
  "status": "pending",
  "behaviors": [
    {
      "type": "fabricated",
      "verdict": "suspected",
      "basis": "특검은 이일준 회장 등이 2023년 삼부토건이 우크라이나 재건 사업에 본격 진출하는 것처럼 허위 보도자료를 배포해 투자자를 속였다고 봅니다. 신규철 본부장은 공소사실을 인정했고 다른 피고인들은 부인합니다. 1심 진행 중입니다.",
      "sourceIds": ["news-lawtimes-210857", "news-newsis-20250804", "news-ajunews-20260116"]
    },
    {
      "type": "concealed",
      "verdict": "suspected",
      "basis": "맞는 말로 틀린 인상을 준 유형입니다. MOU 체결 자체는 실제 있었지만, 특검은 회사가 재건 사업을 수행할 역량이 없었는데도 사업을 추진하는 것처럼 보이게 했다고 봅니다. 업무협약 문서와 후속 발주 여부는 확인하지 못했습니다.",
      "sourceIds": ["news-dealsite-104770", "news-newsis-20250804", "news-ajunews-20260116"]
    }
  ],
  "contrast": {
    "before": {
      "label": "삼부토건 발표 (2023-06-02 보도)",
      "text": "우크라이나 이르핀시와 재건사업 업무협약을 맺고 재건사업 프로젝트를 공동 발굴하기로 했다고 밝혔습니다.",
      "sourceId": "news-dealsite-104770"
    },
    "after": {
      "label": "특검 기소 (2025-08-04 브리핑)",
      "text": "회사가 역량이 없음에도 우크라이나 재건 사업을 추진하는 것처럼 보이게 해 주가를 올렸고, 전현직 임원들이 주식을 팔아 시세차익을 얻었다고 봤습니다.",
      "sourceId": "news-newsis-20250804"
    }
  },
  "levels": { "behavior": "suspected", "intent": "suspected", "harm": "insufficient", "legal": "suspected" },
  "legalStatus": "특검 구속기소(2025-08-01) 뒤 서울중앙지법 1심 진행 중(29차 공판 2026-08-21). 선고 미확인",
  "ach": {
    "best": "undecided",
    "strongestCounter": "정창래 씨는 우크라이나 지자체와의 MOU 체결 자체에 허위가 없고 보도자료 배포에 관여하지 않았다고 주장합니다. 이일준 회장 측은 주식 매각으로 얻은 이익이 없다고, 이응근 전 대표 측은 심부름 역할이었다고 주장합니다.",
    "decisiveEvidence": "MOU 전문과 후속 발주 여부, 보도자료 작성·승인 기록, 피고인별 매도 계획과 홍보 일정의 선후, 1심 판결의 피고인별 판단."
  },
  "beneficiary": "특검은 피고인들이 공모해 약 369억원의 부당이득을 얻었다고 봅니다. 수사기관 산정이며 법원이 인정한 금액이 아닙니다.",
  "impact": 85,
  "impactReason": "재건 사업 홍보 뒤 두 달 새 주가가 1000원대에서 5500원까지 오른 사건에 대한 공소이고, 특검이 수사한 사건으로 사회적 관심이 큽니다.",
  "cover": null,
  "video": null,
  "body": [
    { "h": "MOU가 있었다는 사실과 사업 능력은 다른 질문입니다" },
    {
      "p": "삼부토건이 2023년 우크라이나 지자체와 업무협약을 맺은 것은 회사 발표로 확인됩니다. 특검이 문제 삼은 것은 협약의 존재가 아니라, 수행 역량 없이 재건 사업에 본격 진출하는 것처럼 홍보한 뒤 주식을 팔았다는 점입니다. 피고인별 입장은 갈립니다. 신규철 경영지원본부장은 공소사실을 모두 인정했고, 정창래 씨와 디와이디 법인은 부인했습니다.",
      "sourceIds": ["news-dealsite-104770", "news-lawtimes-210857", "news-ajunews-20260116", "news-news1-6041330"]
    },
    { "h": "확인한 순서" },
    {
      "list": [
        "2023-02 이일준 회장이 지배하는 디와이디가 삼부토건 경영권을 인수한 뒤 유상증자 등으로 최대주주가 됐습니다.",
        "2023-05 폴란드에서 열린 우크라이나 재건 포럼을 계기로 여러 MOU를 맺었다고 홍보했습니다. 당시 1000원대 주가는 두 달 뒤 5500원까지 올랐습니다.",
        "2023-06-01 우크라이나 이르핀시와 재건사업 업무협약을 맺었고 다음 날 발표했습니다.",
        "2025-08-01 특검이 이일준 회장과 이응근 전 대표를 자본시장법 위반(사기적 부정거래) 등 혐의로 구속기소했습니다.",
        "2025-08-26 첫 공판준비기일에서 이일준 회장과 이응근 전 대표 측이 혐의를 부인했습니다.",
        "2025-09-26 이기훈 전 부회장이 369억원 부당이득 혐의로 구속기소됐다는 보도가 나왔습니다.",
        "2025-10-31 첫 공판에서 이일준·이기훈·이응근 피고인이 혐의를 부인했습니다.",
        "2026-01-16 서울중앙지법 형사합의34부가 정창래 씨·신규철 본부장 사건을 병합했습니다.",
        "2026-08-21 이일준 회장이 29차 공판에 출석했습니다."
      ]
    },
    {
      "p": "수사는 민중기 특별검사팀(김건희 특검)이 맡았습니다. 이 기록은 공소 내용과 피고인 주장을 나란히 적었을 뿐이며, 법원 판단은 아직 나오지 않았습니다.",
      "sourceIds": ["news-ajunews-20260116", "news-newspim-20260821"]
    }
  ],
  "rebuttal": [
    {
      "label": "이일준 회장 측 변호인 (2025-08-26)",
      "text": "공소사실을 부인하며 이일준 회장은 삼부토건 주식 매각으로 이익을 취한 게 한 푼도 없다고 주장했습니다.",
      "sourceId": "news-lawtimes-210857"
    },
    {
      "label": "이응근 전 대표 측 변호인 (2025-08-26)",
      "text": "단순히 심부름 역할을 한 이응근을 369억원 규모 범행의 공범으로 볼 수 없다고 주장했습니다.",
      "sourceId": "news-lawtimes-210857"
    },
    {
      "label": "이기훈 전 부회장 측 변호인 (2025-10-31)",
      "text": "특검이 전제하는 사실들은 실제와 다르다며 혐의를 부인했습니다.",
      "sourceId": "news-news1-5960531"
    },
    {
      "label": "정창래 씨 (2026-01-16)",
      "text": "우크라이나 지자체와의 업무협약 체결 자체에는 허위가 없고, 보도자료 배포 업무에 관여하지 않았다고 주장했습니다.",
      "sourceId": "news-ajunews-20260116"
    },
    {
      "label": "디와이디 측 (2026-01-16)",
      "text": "실익이 있었는지를 다투겠다며 공소사실을 부인했습니다.",
      "sourceId": "news-ajunews-20260116"
    }
  ],
  "sources": [
    { "id": "news-dealsite-104770", "kind": "news", "publisher": "딜사이트", "title": "삼부토건, 우크라이나 이르핀시와 재건사업 업무협약", "url": "https://dealsite.co.kr/articles/104770", "publishedAt": "2023-06-02", "accessedAt": "2026-10-21" },
    { "id": "news-newsis-20250804", "kind": "news", "publisher": "뉴시스", "title": "특검, '주가조작' 삼부토건 전현직 임원들 첫 구속기소(종합)", "url": "https://mobile.newsis.com/view/NISX20250804_0003278004", "publishedAt": "2025-08-04", "accessedAt": "2026-10-21" },
    { "id": "news-lawtimes-210857", "kind": "news", "publisher": "법률신문", "title": "'삼부토건 주가조작' 첫 재판 … 이일준 회장·이응근 전 대표 혐의 부인", "url": "https://www.lawtimes.co.kr/news/articleView.html?idxno=210857", "publishedAt": "2025-08-26", "accessedAt": "2026-10-21" },
    { "id": "news-news1-5926017", "kind": "news", "publisher": "뉴스1", "title": "'삼부토건 주가조작' 이기훈 전 부회장 구속기소…\"369억원 부당이득\"", "url": "https://www.news1.kr/society/general-society/5926017", "publishedAt": "2025-09-26", "accessedAt": "2026-10-21" },
    { "id": "news-news1-5960531", "kind": "news", "publisher": "뉴스1", "title": "'삼부토건 주가조작' 3인방, 첫 공판서 혐의 부인…\"오래전부터 사업검토\"", "url": "https://www.news1.kr/society/court-prosecution/5960531", "publishedAt": "2025-10-31", "accessedAt": "2026-10-21" },
    { "id": "news-ajunews-20260116", "kind": "news", "publisher": "아주경제", "title": "'삼부토건 주가조작 공범' 정창래, 첫 재판서 혐의 부인", "url": "https://www.ajunews.com/view/20260116112714979", "publishedAt": "2026-01-16", "accessedAt": "2026-10-21" },
    { "id": "news-news1-6041330", "kind": "news", "publisher": "뉴스1", "title": "'삼부토건 주가조작' 정창래 대표, 첫 재판서 혐의 부인", "url": "https://www.news1.kr/society/court-prosecution/6041330", "publishedAt": "2026-01-16", "accessedAt": "2026-10-21" },
    { "id": "news-newspim-20260821", "kind": "news", "publisher": "뉴스핌", "title": "재판 출석하는 이일준 삼부토건 회장", "url": "https://www.newspim.com/news/view/20260821000428", "publishedAt": "2026-08-21", "accessedAt": "2026-10-21" }
  ],
  "related": [],
  "flaggedAt": "2026-10-21",
  "updatedAt": "2026-10-21T00:00:00+09:00",
  "origin": "seed",
  "locked": false
}
