{
  "schemaVersion": 1,
  "id": "sillajen-bw-2014",
  "subject": "신라젠",
  "instruments": [{ "code": "215600", "name": "신라젠" }],
  "aliases": ["문은상", "크레스트파트너", "SillaJen"],
  "topics": ["신주인수권부사채", "BW", "자금 돌리기", "자금돌리기", "크레스트파트너", "파기환송", "배임", "350억"],
  "speaker": "문은상 전 대표 등 2014년 당시 신라젠 경영진 (판결상 감사·대표이사·이사)",
  "audience": "신라젠 주주와 이후 주식 투자자",
  "title": "신라젠 전 경영진, BW 350억 자금 돌리기",
  "headline": [
    "대법원은 신라젠 경영진 등이 빌린 350억원으로 BW 대금을 넣은 뒤 회사가 같은 날 그 돈을 다시 빌려줘 실질 납입이 없었다고 판단했습니다.",
    "대법원은 회사 손해를 인수대금 350억원으로 봐야 한다며 사건을 돌려보냈고, 이후 형이 확정됐는지는 확인하지 못했습니다."
  ],
  "status": "confirmed",
  "resolution": {
    "sourceId": "official-lawgo-232815",
    "at": "2022-06-30",
    "note": "대법원 2022도3784 파기환송 판결. 자금돌리기로 BW 인수대금이 실질 납입되지 않았다고 판단. 형의 확정 여부는 미확인."
  },
  "behaviors": [
    {
      "type": "concealed",
      "verdict": "confirmed",
      "basis": "대법원은 피고인들이 빌린 350억원으로 BW 인수대금을 넣고 회사가 같은 날 그 돈을 빌려준 쪽에 다시 대여해 실질 인수대금이 납입되지 않았다고 판단했습니다. 납입 외관과 실질의 차이를 숨긴 성격입니다. 중요사항 거짓 기재 부분은 원심이 이유무죄로 봤고 대법원도 검사 주장을 받아들이지 않았으나, 일죄 관계로 함께 환송됐습니다.",
      "sourceIds": ["official-lawgo-232815", "official-scourt-4566"]
    }
  ],
  "contrast": {
    "before": {
      "label": "BW 발행 외형 (2014-03-04)",
      "text": "신라젠은 총액 350억원의 BW를 발행했고, 인수인들은 인수대금 350억원을 회사에 납입했습니다.",
      "sourceId": "official-lawgo-232815"
    },
    "after": {
      "label": "대법원 판단 (2022-06-30)",
      "text": "회사는 같은 날 350억원을 자금을 빌려준 회사에 대여했고 그 돈은 3월 6일 원래 대주에게 상환됐습니다. 대법원은 실질 인수대금 없이 BW가 발행됐다고 판단했습니다.",
      "sourceId": "official-lawgo-232815"
    }
  },
  "levels": { "behavior": "confirmed", "intent": "suspected", "harm": "suspected", "legal": "suspected" },
  "legalStatus": "대법원 파기환송(2022-06-30), 환송심 문은상 징역 5년·벌금 10억원(2022-12-08 보도). 이후 확정 여부는 미확인",
  "ach": {
    "best": "H2",
    "strongestCounter": "피고인 측은 회사 존립이 위태로운 상황에서 자금을 마련하려 BW를 발행했을 뿐 개인 이득이 목적이 아니었다고 주장했습니다. 환송심도 실질 피해액은 10억원 정도로 보고, 투자자 손해에는 임상 실패에서 비롯된 측면이 있다고 했습니다.",
    "decisiveEvidence": "환송심 이후 재상고·확정 기록, 당시 투자자에게 제공된 BW 납입 관련 설명 원문, 자금을 빌려준 금융회사 담당자별 인지 자료"
  },
  "beneficiary": "대법원은 인수인들이 사채가액 350억원의 이득을 얻고 회사가 같은 금액의 손해를 입었다고 봤습니다. 검찰이 주장한 부당이득 1,918억여원은 원심이 산정 곤란으로 보았고, 대법원도 검사 주장을 받아들이지 않았지만 유죄 부분과 함께 환송됐습니다.",
  "impact": 70,
  "impactReason": "상장 전 최대주주 측 지분 확보 방식이 이후 상장과 투자자 유입의 전제가 됐고, 경영진 형사 사건으로 2020년 거래정지까지 이어졌습니다.",
  "cover": "https://i.ytimg.com/vi/1S0jiWi99dY/hqdefault.jpg",
  "video": {"youtube": "1S0jiWi99dY", "title": "문은상 전 신라젠 대표 2심도 징역 5년…벌금 감경 / 연합뉴스TV (YonhapnewsTV)"},
  "body": [
    { "h": "신약 실패와 BW 납입 문제는 다른 질문입니다" },
    {
      "p": "이 사건은 펙사벡 임상이 실패했는지가 아니라, 2014년 BW를 발행할 때 회사에 실제 돈이 들어왔는지를 묻습니다. 대법원은 피고인들이 빌린 돈으로 인수대금을 넣고 회사가 곧바로 그 돈을 빌려준 쪽에 되돌려 차용금 변제에 쓰이게 했다면 실질 납입이 없다고 봤습니다. 2019년 임상 악재 전 주식 매도 사건(무죄)과는 사람·행위가 다른 별개 사건입니다.",
      "sourceIds": ["official-lawgo-232815", "official-scourt-4566"]
    },
    { "h": "확인한 순서" },
    {
      "list": [
        "2014-03-04 자금을 빌려준 회사가 피고인 측 회사(H)의 무보증 사모사채 350억원을 인수했고, 피고인들은 H에서 350억원을 빌려 BW 인수대금으로 신라젠에 납입했습니다.",
        "2014-03-04 신라젠은 총액 350억원의 BW를 발행하고, 같은 날 350억원을 H에 대여했습니다.",
        "2014-03-06 H는 그 돈을 원래 대주에게 송금해 사모사채를 갚았습니다.",
        "2015-03-04 피고인들이 BW 조기상환을 청구해 원리금을 받았고, 같은 날 피고인들·신라젠·H 사이 금전 거래가 정산됐습니다.",
        "2022-02-25 서울고법(2021노1732)은 손해액을 10억5,000만원으로 보고 특경법 배임 부분을 이유무죄로 판단했습니다.",
        "2022-06-30 대법원은 손해액이 인수대금 350억원이라며 유죄 부분을 파기환송했습니다.",
        "2022-12-08 환송심은 배임액 350억원을 인정하고 문은상 전 대표에게 징역 5년·벌금 10억원을 선고했다고 보도됐습니다."
      ]
    },
    {
      "p": "대법원은 자본시장법상 '부정한 수단 등 사용' 유죄 판단을 다툰 피고인 측 상고이유를 받아들이지 않았습니다. 다만 형을 다시 정하도록 유죄 부분 전체가 환송돼 확정된 것은 아닙니다. '중요사항 거짓 기재' 혐의와 부당이득 1,918억여원 산정에 대한 검사의 상고이유는 받아들여지지 않았지만, 유죄 부분과 일죄 관계여서 함께 파기환송됐습니다.",
      "sourceIds": ["official-lawgo-232815"]
    },
    { "h": "구분해 둔 것" },
    {
      "p": "판결문은 피고인 이름을 가렸고(법령정보센터본은 신라젠·동부증권·크레스트파트너를 실명으로 적음), 문은상 전 대표와의 연결은 대법원 게시 제목과 보도로 확인했습니다. 보도는 페이퍼컴퍼니 크레스트파트너를 통해 DB금융투자에서 350억원을 빌렸다고 전하지만, 금융회사가 대출했다는 사실만으로 그 임직원의 공모를 추정하지 않았습니다.",
      "sourceIds": ["official-scourt-4566", "news-newspim-20221208", "news-hankookilbo-20221208"]
    }
  ],
  "rebuttal": [
    {
      "label": "피고인 측 (환송심)",
      "text": "신라젠 존립이 위태로운 상황에서 인수 자금을 마련하려 BW를 발행했을 뿐 개인적 이득을 노린 것이 아니라고 주장했습니다.",
      "sourceId": "news-newspim-20221208"
    }
  ],
  "sources": [
    { "id": "official-lawgo-232815", "kind": "official", "publisher": "국가법령정보센터 (대법원 판례)", "title": "대법원 2022. 6. 30. 선고 2022도3784 판결", "url": "https://www.law.go.kr/LSW/precInfoP.do?precSeq=232815", "publishedAt": "2022-06-30", "accessedAt": "2026-10-21" },
    { "id": "official-scourt-4566", "kind": "official", "publisher": "대법원", "title": "대법 '자금 돌리기' 문은상 전 신라젠 대표 사건 파기환송 (판결문 첨부)", "url": "https://www.scourt.go.kr/portal/news/NewsViewAction.work?seqnum=4566&gubun=2&searchOption=&searchWord=", "publishedAt": "2022-07-04", "accessedAt": "2026-10-21" },
    { "id": "news-edaily-20220630", "kind": "news", "publisher": "이데일리", "title": "대법, '자금 돌리기' 문은상 전 신라젠 대표 사건 파기환송", "url": "https://edaily.co.kr/News/Read?mediaCodeNo=257&newsId=02250086632366968", "publishedAt": "2022-06-30", "accessedAt": "2026-10-21" },
    { "id": "news-newspim-20221208", "kind": "news", "publisher": "뉴스핌", "title": "'신라젠 배임' 문은상 前대표, 파기환송심도 징역 5년·벌금 10억", "url": "https://www.newspim.com/news/view/20221208000672", "publishedAt": "2022-12-08", "accessedAt": "2026-10-21" },
    { "id": "news-hankookilbo-20221208", "kind": "news", "publisher": "한국일보", "title": "'신라젠 배임' 문은상... 파기환송심도 징역 5년·벌금 10억", "url": "https://www.hankookilbo.com/news/article/A2022120815170000867", "publishedAt": "2022-12-08", "accessedAt": "2026-10-21" }
  ],
  "related": [],
  "flaggedAt": "2026-10-21",
  "resolvedAt": "2022-06-30",
  "updatedAt": "2026-10-21T00:00:00+09:00",
  "origin": "seed",
  "locked": false
}
