{
  "schemaVersion": 1,
  "id": "khfeelux-bio-2018",
  "subject": "KH필룩스",
  "instruments": [{ "code": "033180", "name": "KH필룩스" }],
  "aliases": ["필룩스", "KH FEELUX", "케이에이치필룩스"],
  "topics": ["암 치료제", "미국 바이오", "바이오 신사업", "631억", "전환사채", "사기적 부정거래", "1심 무죄"],
  "speaker": "박모·안모 전 부회장, 전 대표 등 KH필룩스 전 임원 3명 (검찰 공소 기준)",
  "audience": "2018년 신사업 공시를 보고 KH필룩스 주식을 산 투자자",
  "title": "KH필룩스 전 임원 바이오 공시 1심 무죄",
  "headline": [
    "1심은 2018년 미국 바이오 업체 투자·암 치료제 공동개발을 내세워 주가를 띄웠다는 혐의로 기소된 KH필룩스 전 임원 3명 전원에게 무죄를 선고했습니다.",
    "재판부는 유상증자 공시가 사기적 부정거래에 해당할 여지가 크다고 하면서도 피고인들의 공모·관여 증거가 부족하다고 봤고, 항소 여부는 확인하지 못했습니다."
  ],
  "status": "pending",
  "behaviors": [
    {
      "type": "fabricated",
      "verdict": "suspected",
      "basis": "1심은 회사가 바이오 사업을 실제로 추진할 의사가 있었고 추진했다고 봤습니다. 다만 유상증자 공시는 허위 공시로서 사기적 부정거래에 해당할 여지가 크다고 했습니다. 그 공시에 누가 관여했는지는 확인되지 않았고, 기소된 3명의 관여는 증거 부족으로 인정되지 않았습니다.",
      "sourceIds": ["news-heraldcorp-10642344", "news-edaily-20251223"]
    }
  ],
  "contrast": {
    "before": {
      "label": "검찰 공소",
      "text": "2018년 2~9월 미국 바이오 업체에 투자받아 암 치료제를 공동 개발한다는 허위 사실을 퍼뜨려 주가를 올린 뒤 631억원의 부당이득을 얻었다고 봤습니다.",
      "sourceId": "news-edaily-20251223"
    },
    "after": {
      "label": "1심 판단 (2025-12-23)",
      "text": "공시는 사기적 부정거래에 해당할 여지가 크지만, 피고인들이 공모하거나 관여했다는 증거가 충분하지 않다며 전원 무죄를 선고했습니다.",
      "sourceId": "news-heraldcorp-10642344"
    }
  },
  "levels": { "behavior": "suspected", "intent": "insufficient", "harm": "insufficient", "legal": "insufficient" },
  "legalStatus": "1심 3명 전원 무죄(2025-12-23 서울남부지법 형사합의15부). 항소·2심 여부 미확인",
  "ach": {
    "best": "undecided",
    "strongestCounter": "재판부는 회사가 바이오 사업을 실제로 추진했다고 봤고, 전환사채 전환권 행사로 차익을 얻었다는 사실만으로 허위 공시 관여를 인정할 수 없다고 했습니다.",
    "decisiveEvidence": "1심 판결서 원문과 항소심 판단, 유상증자 공시 작성·승인 과정의 내부 기록. 공시 관여자가 특정되지 않으면 개인별 책임은 판단할 수 없습니다."
  },
  "impact": 45,
  "impactReason": "종가 기준 주가가 3,480원에서 27,150원으로 오른 뒤 2023년 감사의견 거절로 거래가 정지된 종목입니다. 1심 무죄라 공시 허위 여부와 개인 책임을 나눠 봐야 합니다.",
  "cover": null,
  "video": null,
  "body": [
    { "h": "무엇이 무죄인지" },
    {
      "p": "박모·안모 전 부회장과 전 대표 등 3명이 받은 자본시장법 위반 혐의가 1심에서 모두 무죄였습니다. 검찰은 이들이 신사업 허위 공시로 주가를 띄운 뒤 차명 보유 주식과 전환사채를 팔아 약 631억원을 얻었다고 봤고, 박 전 부회장에게 징역 15년을 구형했습니다. 1심 판결이며 확정 여부는 확인하지 못했습니다.",
      "sourceIds": ["news-heraldcorp-10642344", "news-edaily-20251223"]
    },
    {
      "p": "재판부 판단은 두 갈래입니다. 회사가 바이오 사업을 추진할 의사가 있었고 실제로 추진했으므로 주가 부양만을 위한 가공의 사업으로 보기 어렵다고 했습니다. 동시에 유상증자 공시는 사기적 부정거래에 해당할 여지가 크다고 했습니다. 공시가 문제일 수 있다는 판단과 기소된 3명이 그 공시에 관여했다는 판단은 다르며, 재판부는 뒤의 것을 인정하지 않았습니다.",
      "sourceIds": ["news-heraldcorp-10642344"]
    },
    {
      "p": "재판부는 주도자로 보이는 배상윤 KH그룹 회장이 해외로 도피해 조사가 이뤄지지 않은 상태에서 기소됐고, 현 단계 증거로는 이런 결론이 불가피하다고 했습니다. 배 회장은 이 재판의 피고인이 아니며 그의 책임은 법원에서 판단된 적이 없습니다.",
      "sourceIds": ["news-edaily-20251223", "news-heraldcorp-10642344"]
    },
    { "h": "확인한 순서" },
    {
      "list": [
        "2018-02~09 미국 바이오 업체 투자와 암 치료제 공동개발이라는 허위 사실을 퍼뜨렸다는 것이 검찰 공소사실입니다.",
        "2023-04 감사의견 거절로 매매거래가 정지됐습니다.",
        "2024-06 박·안 전 부회장이 도피 중 필리핀에서 붙잡혀 송환·구속됐고, 2024-12 보석으로 풀려났습니다.",
        "2025-12-23 서울남부지법 형사합의15부가 3명 전원에게 무죄를 선고했습니다.",
        "항소와 2심 진행 여부는 확인하지 못했습니다."
      ]
    }
  ],
  "rebuttal": [],
  "sources": [
    { "id": "news-edaily-20251223", "kind": "news", "publisher": "이데일리", "title": "KH필룩스 前임원 '주가조작' 1심 무죄…\"배상윤 도피로 조사 안 된 채 기소\"", "url": "https://www.edaily.co.kr/News/Read?newsId=03312806642401472&mediaCodeNo=257", "publishedAt": "2025-12-23", "accessedAt": "2026-10-21" },
    { "id": "news-heraldcorp-10642344", "kind": "news", "publisher": "헤럴드경제", "title": "암 치료제 개발 재료로 주가 띄워 631억 차익에도 무죄…KH필룩스 前임원들 1심 ‘전원 무죄’ 왜? [세상&]", "url": "https://biz.heraldcorp.com/article/10642344", "publishedAt": "2025-12-23", "accessedAt": "2026-10-21" },
    { "id": "news-smarttoday-28771", "kind": "news", "publisher": "스마트투데이", "title": "KH필룩스, 감사의견 의견거절", "url": "https://www.smarttoday.co.kr/ko-kr/articles/28771", "publishedAt": "2023-04-07", "accessedAt": "2026-10-21" }
  ],
  "related": [],
  "flaggedAt": "2026-10-21",
  "updatedAt": "2026-10-21T00:00:00+09:00",
  "origin": "seed",
  "locked": false
}
