{
  "schemaVersion": 1,
  "id": "quantapia-cb-2023",
  "subject": "퀀타피아",
  "instruments": [{ "code": "078940", "name": "퀀타피아" }],
  "aliases": ["코드네이처"],
  "topics": ["투자확약서", "1000억원 규모 자금조달", "전환사채", "허위 공시", "시세조종", "전직 검찰수사관", "서울남부지법", "구속기소"],
  "speaker": "1심 피고인들(전직 검찰수사관 이모씨 등 외부 투자자 일당). 퀀타피아 임직원은 입건되지 않았다는 보도",
  "audience": "퀀타피아 공시를 보고 주식을 사고판 투자자",
  "title": "퀀타피아 1000억 투자확약 공시 주가조작 1심",
  "headline": [
    "2023년 6월 퀀타피아의 1000억원 규모 자금조달 공시는 허위 투자확약서에 근거했다는 것이 검찰 공소이며, 1심은 피고인들에게 유죄를 선고했습니다.",
    "1심은 투자확약서가 명의자의 허락 없이 임의로 작성된 것으로 보인다고 지적했지만, 판결은 아직 확정되지 않았습니다."
  ],
  "status": "pending",
  "behaviors": [
    {
      "type": "fabricated",
      "verdict": "suspected",
      "basis": "검찰은 피고인들이 2023년 6월 1000억원 규모 자금조달 계획을 허위로 공시하게 해 약 50억원을 얻었다고 기소했습니다. 1심은 자본시장법 위반을 유죄로 보고 확약서가 명의자 허락 없이 작성된 것으로 보인다고 했습니다. 판결 원문을 확인하지 못했고 확정 전이라 의심 단계로 둡니다.",
      "sourceIds": ["news-asiae-20260929", "news-inews24-20260929", "news-newsis-20241115"]
    }
  ],
  "contrast": {
    "before": {
      "label": "2023년 6월 공시 (판결 보도 기준)",
      "text": "‘1000억원 상당 투자가 확정됐다’는 투자확약서를 근거로 1000억원 규모 자금조달 계획이 공시됐습니다.",
      "sourceId": "news-inews24-20260929"
    },
    "after": {
      "label": "서울남부지법 1심 (2026-09-29)",
      "text": "재판부는 투자확약서가 명의자의 허락 없이 임의로 작성된 것으로 보인다고 지적했습니다.",
      "sourceId": "news-asiae-20260929"
    }
  },
  "levels": { "behavior": "suspected", "intent": "suspected", "harm": "insufficient", "legal": "suspected" },
  "legalStatus": "서울남부지법 1심 일부 유죄·일부 무죄 선고(2026-09-29, 보도 기준). 판결 원문·항소 여부 미확인",
  "ach": {
    "best": "H2",
    "strongestCounter": "배모씨를 뺀 피고인들은 공소사실을 부인했고, 1심은 확정되지 않았습니다. 1심도 주범의 전환사채 관련 부당이득을 공소의 50억원이 아닌 31억원만 인정했고, 일부 피고인의 일부 혐의는 무죄로 봤습니다.",
    "decisiveEvidence": "1심 판결문의 공소사실별 판단, 투자확약서 원본과 명의자 진술, 2023년 6월 공시 원문, 항소심 판단."
  },
  "beneficiary": "공소상 이익은 허위 공시 약 50억원, 퀀타피아 시세조종 약 11억원입니다. 1심은 주범의 전환사채 관련 부당이득을 31억원만 인정했습니다. 회사가 얻은 이익이 아닙니다.",
  "impact": 60,
  "impactReason": "1000억원 규모 자금조달 공시가 확약서 진위에 달려 있었다는 점이 공시를 믿고 거래한 투자자 판단에 직접 연결됩니다.",
  "cover": null,
  "video": null,
  "body": [
    { "h": "공시한 회사와 확약서를 꾸민 사람은 따로 봐야 합니다" },
    {
      "p": "이 사건의 피고인은 퀀타피아 회사나 임직원이 아니라 외부 투자자 일당입니다. 1심 보도에 따르면 재판부는 2023년 6월 1000억원 규모 자금조달 계획 공시의 근거가 된 투자확약서가 명의자의 허락 없이 임의로 작성된 것으로 보인다고 지적했습니다. 퀀타피아와 최대주주 샌드크래프트 임직원 8명은 참고인 조사를 받았지만 입건되지 않았다는 보도가 있습니다.",
      "sourceIds": ["news-asiae-20260929", "news-inews24-20260929", "news-newstomato-1250947"]
    },
    { "h": "확인한 순서" },
    {
      "list": [
        "2023-05~12 피고인들이 퀀타피아 주식을 시세조종해 약 11억원을 얻었다는 것이 공소 내용입니다.",
        "2023-06 1000억원 규모 자금조달 계획을 허위로 공시해 약 50억원을 얻었다는 것이 공소 내용입니다.",
        "2023-09-22 코드네이처가 퀀타피아로 상호를 변경한다고 공시했습니다.",
        "2024-11-15 서울남부지검 금융·증권범죄합동수사부가 투자자 이모(58)씨를 구속기소했다고 발표했습니다. 중앙디앤엠 시세조종 140억원을 포함해 총 201억원 부당이득 혐의입니다.",
        "2025-01-15 퀀타피아·샌드크래프트 임직원 8명이 입건되지 않았다는 보도가 나왔습니다.",
        "2026-09-29 서울남부지법은 주범인 전직 검찰수사관 이씨(61)에게 징역 10년·벌금 240억원, 공범 오모씨 징역 8년, 최모씨 징역 7년, 문모씨 징역 5년, 이씨(59)에게 징역 3년6개월·벌금 4억원을 선고했습니다."
      ]
    },
    {
      "p": "이씨(59)의 엑스큐어 시세조종 혐의와 변호사법 위반 혐의는 1심에서 무죄였습니다. 엑스큐어는 다른 종목이며 이 사건과 같은 유죄로 묶지 않았습니다. 2018년 매출원가 허위 계상으로 퀀타피아가 2023년 12월 증선위 과징금 6000만원을 받은 일은 별개 사안입니다.",
      "sourceIds": ["news-asiae-20260929", "news-inews24-20260929", "news-newsis-20241115"]
    },
    { "h": "확인하지 못한 것" },
    {
      "p": "2023년 6월 공시 원문, 투자확약서 원본, 1심 판결문 원문과 항소 여부는 확인하지 못했습니다. 탐색 단계에서 거론된 양자 이미지센서·비침습 혈당 기술 홍보도 이번에 읽은 원문에서는 확인하지 못해 쓰지 않았습니다.",
      "sourceIds": ["news-asiae-20260929"]
    }
  ],
  "rebuttal": [
    {
      "label": "피고인 이씨(59) 측",
      "text": "퀀타피아 주식 매매는 개인적 판단에 따른 투자였고 시세조종에 공모하거나 가담한 사실이 없다고 주장했습니다.",
      "sourceId": "news-asiae-20260929"
    },
    {
      "label": "퀀타피아 관계자 (2025-01-15)",
      "text": "사건은 개인 투자자의 불법행위에 초점이 맞춰져 있고 회사 차원의 조직적 개입이나 기술적 사기 혐의는 확인되지 않았다고 했습니다.",
      "sourceId": "news-newstomato-1250947"
    }
  ],
  "sources": [
    { "id": "news-asiae-20260929", "kind": "news", "publisher": "아시아경제", "title": "'퀀타피아 주가조작' 이승기 장인 징역 3년6개월", "url": "https://view.asiae.co.kr/article/2026092911503671171", "publishedAt": "2026-09-29", "accessedAt": "2026-10-21" },
    { "id": "news-inews24-20260929", "kind": "news", "publisher": "아이뉴스24", "title": "가수 이승기 장인, '코스닥 상장사 주가조작' 혐의로 징역 3년 6개월", "url": "https://inews24.com/view/2009975", "publishedAt": "2026-09-29", "accessedAt": "2026-10-21" },
    { "id": "news-newsis-20241115", "kind": "news", "publisher": "뉴시스", "title": "檢, 200억대 주가조작한 퀀타피아 투자자 구속기소", "url": "https://www.newsis.com/view/NISX20241115_0002961038", "publishedAt": "2024-11-15", "accessedAt": "2026-10-21" },
    { "id": "news-newstomato-1250947", "kind": "news", "publisher": "뉴스토마토", "title": "퀀타피아 주가조작 사건…\"임직원 무혐의\"", "url": "https://www.newstomato.com/readnews.aspx?no=1250947", "publishedAt": "2025-01-15", "accessedAt": "2026-10-21" },
    { "id": "news-edaily-20230922", "kind": "news", "publisher": "이데일리", "title": "코드네이처, 퀀타피아로 상호 변경", "url": "https://edaily.co.kr/News/Read?mediaCodeNo=257&newsId=02938886635742744", "publishedAt": "2023-09-22", "accessedAt": "2026-10-21" }
  ],
  "related": [],
  "flaggedAt": "2026-10-21",
  "updatedAt": "2026-10-21T00:00:00+09:00",
  "origin": "seed",
  "locked": false
}
