{
  "schemaVersion": 1,
  "id": "xcure-ai-robot-2024",
  "subject": "엑스큐어",
  "instruments": [{ "code": "070300", "name": "엑스큐어(현 퀀텀레일)" }],
  "aliases": ["퀀텀레일", "Xcure", "QuantumRail"],
  "topics": ["AI 로봇", "풍문", "시세조종", "이승기 장인", "전직 검찰수사관", "남부지법", "1심 무죄", "연쇄 주가조작"],
  "speaker": "주가조작 혐의로 기소된 개인들 (검찰 공소 기준, 회사가 아님)",
  "audience": "2024년 7월 엑스큐어 주식을 사고판 투자자",
  "title": "엑스큐어 AI 로봇 풍문 혐의 1심 무죄",
  "headline": [
    "엑스큐어 AI 로봇 사업 풍문·시세조종 혐의는 2026년 9월 29일 1심에서 무죄가 선고됐다고 보도됐습니다.",
    "검찰은 사업 추진이 불투명한데도 확정적이라는 풍문을 퍼뜨렸다고 기소했지만, 법원은 증거가 부족하다고 봤습니다. 확정 여부는 확인하지 못했습니다."
  ],
  "status": "pending",
  "behaviors": [
    {
      "type": "fabricated",
      "verdict": "insufficient",
      "basis": "검찰은 AI 로봇 사업 추진이 불투명한데도 확정적이라는 취지의 풍문을 퍼뜨렸다고 기소했습니다. 1심은 엑스큐어 관련 혐의를 \"제출된 증거만으로는 범행을 실행했다고 확신하기에 부족하다\"며 무죄로 봤다고 보도됐습니다. 판결 원문과 항소 여부는 확인하지 못했습니다.",
      "sourceIds": ["official-spo-20250515", "news-fnnews-20260929", "news-seoul-20260929"]
    }
  ],
  "contrast": {
    "before": {
      "label": "검찰 공소 요지 (2025-05-15)",
      "text": "‘丙社의 AI로봇 사업 추진이 불투명하였음에도, 확정적이다’는 취지로 풍문을 유포했다고 밝혔습니다. 보도는 丙社를 엑스큐어로 특정했습니다.",
      "sourceId": "official-spo-20250515"
    },
    "after": {
      "label": "1심 판단 (2026-09-29, 보도)",
      "text": "엑스큐어 관련 혐의는 \"제출된 증거만으로는 범행을 실행했다고 확신하기에 부족하다\"며 무죄로 봤습니다.",
      "sourceId": "news-fnnews-20260929"
    }
  },
  "levels": { "behavior": "insufficient", "intent": "insufficient", "harm": "insufficient", "legal": "insufficient" },
  "legalStatus": "1심 무죄(2026-09-29 서울남부지법 형사합의15부, 보도 기준). 판결 원문·항소·확정 여부 미확인",
  "ach": {
    "best": "undecided",
    "strongestCounter": "1심 재판부가 엑스큐어 관련 혐의를 증거 부족으로 무죄로 봤습니다. 검찰 공소사실은 재판으로 확정된 사실이 아니라고 보도자료 스스로 적고 있습니다.",
    "decisiveEvidence": "판결문의 공소별 주문과 무죄 이유, 검찰 항소 여부와 항소심 판단, 풍문의 원문·유포 경로·시점과 당시 회사 공시의 AI 로봇 사업 내용."
  },
  "impact": 25,
  "impactReason": "검찰 발표상 주가가 2024년 7월 1일 3,470원에서 7월 31일 11,500원으로 올랐지만, 1심이 무죄로 봐 지금은 같은 판결의 다른 종목 유죄와 구분해 둘 사건입니다.",
  "cover": null,
  "video": null,
  "body": [
    { "h": "무죄가 난 부분과 유죄가 난 부분을 나눠 읽어야 합니다" },
    {
      "p": "같은 재판에서 이승기 장인 이씨는 다른 종목 관련 혐의로 징역 3년 6개월과 벌금 4억원을 선고받았고, 전직 검찰수사관 이씨는 징역 10년과 벌금 240억원을 선고받았습니다. 그러나 엑스큐어가 AI 로봇 사업을 추진한다는 소문을 퍼뜨리고 시세조종 주문을 넣었다는 혐의는 무죄로 판단됐다고 보도됐습니다. 다른 종목의 유죄를 이 종목으로 옮길 수 없습니다.",
      "sourceIds": ["news-fnnews-20260929", "news-seoul-20260929"]
    },
    {
      "p": "기소된 것은 회사가 아니라 회사 인수와 시세조종을 설계했다고 검찰이 지목한 개인들입니다. 검찰 보도자료는 회사 이름을 丙社로 가렸고, 보도가 이를 유심 제조업체 엑스큐어로 특정했습니다. 엑스큐어는 2026년 7월 사명을 퀀텀레일로 바꿨습니다.",
      "sourceIds": ["official-spo-20250515", "news-segye-20250516", "news-digitaltoday-20260722"]
    },
    { "h": "확인한 순서" },
    {
      "list": [
        "2024-07 검찰은 丙社 주가가 7월 1일 3,470원에서 7월 31일 11,500원까지 올랐다고 밝혔습니다. 검찰 주장이며 법원이 인정한 수치가 아닙니다.",
        "2025-05-15 서울남부지검이 ‘3개 코스닥 상장사 연쇄 주가조작 사건’ 수사 결과를 발표했습니다. 3차 범행의 소재를 AI 로봇으로 적었습니다.",
        "2025-05-16 보도는 3차 범행 대상을 유심 제조업체 엑스큐어로 특정했습니다.",
        "2026-07-22 엑스큐어(070300)가 사명을 퀀텀레일로 바꿨다고 공시했다는 보도가 나왔습니다.",
        "2026-09-29 서울남부지법 형사합의15부가 엑스큐어 관련 혐의를 무죄로 봤다고 보도됐습니다.",
        "항소 여부, 공소별(풍문 유포·시세조종·미공개정보 이용) 주문과 판결 원문은 확인하지 못했습니다."
      ]
    }
  ],
  "rebuttal": [],
  "sources": [
    { "id": "official-spo-20250515", "kind": "official", "publisher": "서울남부지방검찰청", "title": "첨단기술 테마를 펄로 이용한 주가조작 세력의 ｢3개 코스닥 상장사 연쇄 주가조작 사건｣ 수사 결과", "url": "https://www.spo.go.kr/common/board/Download.do?bcIdx=1080054&cbIdx=1403&streFileNm=6f7d612e-b0b6-45b3-94cb-60d186411bb7.pdf", "publishedAt": "2025-05-15", "accessedAt": "2026-10-21" },
    { "id": "news-segye-20250516", "kind": "news", "publisher": "세계일보", "title": "\"유례없는 주가조작\"… 檢, '이승기 장인' 등 13명 구속 기소", "url": "https://www.segye.com/newsView/20250516505238", "publishedAt": "2025-05-16", "accessedAt": "2026-10-21" },
    { "id": "news-digitaltoday-20260722", "kind": "news", "publisher": "디지털투데이", "title": "엑스큐어, 사명 퀀텀레일로 변경…기업 성장 전략 강화 목적", "url": "https://www.digitaltoday.co.kr/news/articleView.html?idxno=686017", "publishedAt": "2026-07-22", "accessedAt": "2026-10-21" },
    { "id": "news-fnnews-20260929", "kind": "news", "publisher": "파이낸셜뉴스", "title": "'코스닥 상장사 주가조작' 이승기 장인, 징역 3년6개월…법정구속", "url": "https://www.fnnews.com/news/202609291337247995", "publishedAt": "2026-09-29", "accessedAt": "2026-10-21" },
    { "id": "news-seoul-20260929", "kind": "news", "publisher": "서울신문", "title": "연예인 사위에 ‘손절’ 당한 ‘주가조작’ 장인, 1심서 실형 선고받았다", "url": "https://www.seoul.co.kr/news/society/law/2026/09/29/20260929500132", "publishedAt": "2026-09-29", "accessedAt": "2026-10-21" }
  ],
  "related": [],
  "flaggedAt": "2026-10-21",
  "updatedAt": "2026-10-21T00:00:00+09:00",
  "origin": "seed",
  "locked": false
}
