{
  "schemaVersion": 1,
  "id": "cnk-diamond-2010",
  "subject": "CNK인터내셔널",
  "instruments": [{ "code": "039530", "name": "CNK인터내셔널" }],
  "aliases": ["CNK", "오덕균", "씨앤케이인터내셔널"],
  "topics": ["다이아몬드", "카메룬", "요카도우마", "매장량", "캐럿", "에너지자원대사", "외교통상부 보도자료", "사기적 부정거래"],
  "speaker": "오덕균 전 CNK인터내셔널 대표 등 (법률신문 판결 보도 기준)",
  "audience": "CNK인터내셔널 주식을 사고판 투자자",
  "title": "CNK 전 대표, 다이아몬드 허위 공시 유죄 확정",
  "headline": [
    "대법원은 허위 공시·허위 보도자료·언론 인터뷰·홈페이지 공지로 허위사실을 퍼뜨린 사기적 부정거래를 유죄로 본 원심을 확정했습니다.",
    "같은 판결에서 약 900억원 부당이득과 외교통상부 명의 보도자료의 허위성은 증거가 부족하다는 원심 판단도 유지됐습니다."
  ],
  "status": "confirmed",
  "resolution": {
    "sourceId": "official-lawgo-195472",
    "at": "2017-06-08",
    "note": "대법원 2016도3411 상고기각. 사기적 부정거래·대량보유보고 중요사항 미기재 유죄 확정, 900억 부당이득·외교부 보도자료 부분 이유무죄 유지."
  },
  "behaviors": [
    {
      "type": "fabricated",
      "verdict": "confirmed",
      "basis": "원심(서울고법 2015노548)은 피고인들이 공모해 허위 공시, 허위 내용의 보도자료, 언론 인터뷰, 홈페이지 공지사항 등으로 허위사실을 유포했다고 인정했고 대법원이 상고를 기각했습니다. 판결문은 피고인 이름을 가렸고, 법률신문은 오덕균 전 대표가 징역 3년·집행유예 5년을 확정받았다고 보도했습니다.",
      "sourceIds": ["official-lawgo-195472", "news-lawtimes-118685"]
    },
    {
      "type": "concealed",
      "verdict": "confirmed",
      "basis": "원심은 주식 등의 대량보유상황보고서에 다른 7인이 처분을 위임한 보유주식 364,000주에 관한 사항을 적지 않은 것을 중요사항 미기재로 보아 유죄로 인정했고 대법원이 유지했습니다.",
      "sourceIds": ["official-lawgo-195472"]
    }
  ],
  "contrast": {
    "before": {
      "label": "CNK 측 보도자료 (법률신문 판결 보도)",
      "text": "다이아몬드 추정 매장량이 4억1600만 캐럿에 달한다는 내용의 보도자료를 여러 차례 작성·배포했습니다.",
      "sourceId": "news-lawtimes-118685"
    },
    "after": {
      "label": "대법원 판결 (2017-06-08)",
      "text": "허위 공시·허위 보도자료·언론 인터뷰·홈페이지 공지사항 등을 통한 허위사실 유포를 인정한 원심을 그대로 확정했습니다.",
      "sourceId": "official-lawgo-195472"
    }
  },
  "levels": { "behavior": "confirmed", "intent": "confirmed", "harm": "insufficient", "legal": "confirmed" },
  "legalStatus": "대법원 상고기각 확정(2017-06-08, 2016도3411). 약 900억원 부당이득·외교부 보도자료 부분은 이유무죄",
  "ach": {
    "best": "H2",
    "strongestCounter": "법원은 외교통상부 명의 1·2차 보도자료의 허위성과 피고인 1의 허위 인식·공모를 인정하지 않았습니다. 정부 발표가 공시 심사를 우회하는 통로였다는 가설은 이 판결로 뒷받침되지 않습니다.",
    "decisiveEvidence": "원심 2015노548 판결문 전문의 공시·보도자료별 인정 사실, 당시 탐사 보고서 원문, 임직원 주식 처분 시점 기록"
  },
  "impact": 70,
  "impactReason": "보도자료 이후 한 달여 동안 주가가 약 5배 올랐다는 보도가 있습니다. 확정된 피해액은 아닙니다.",
  "cover": "https://i.ytimg.com/vi/D40_FVcM0p0/hqdefault.jpg",
  "video": {"youtube": "D40_FVcM0p0", "title": "'다이아는 없었다'...대국민 사기극으로 끝난 'CNK 사건'"},
  "body": [
    { "h": "법원이 인정한 것과 인정하지 않은 것이 나뉩니다" },
    {
      "p": "대법원 판결은 원심이 피고인들의 허위 공시, 허위 보도자료, 언론 인터뷰, 홈페이지 공지사항을 통한 허위사실 유포를 사기적 부정거래로 인정한 부분을 확정했습니다. 반면 외교통상부 명의 1·2차 보도자료 배포로 인한 부정거래 부분과 약 900억원 부당이득 가중처벌 부분은 증거 부족으로 이유무죄가 유지됐습니다. 외교통상부 보도자료 작성과 관련해 기소된 피고인 1은 부정거래·허위공문서작성·직권남용 등 혐의에서 모두 무죄가 유지됐습니다.",
      "sourceIds": ["official-lawgo-195472"]
    },
    {
      "p": "판결문은 피고인을 번호로만 적습니다. 법률신문은 오덕균 전 CNK인터내셔널 대표가 1심 징역 1년 6개월·집행유예 2년에서 2심 징역 3년·집행유예 5년으로 형이 늘어 확정됐고, 김은석 전 외교통상부 에너지자원대사는 무죄가 확정됐다고 보도했습니다.",
      "sourceIds": ["news-lawtimes-118685"]
    },
    { "h": "확인한 순서" },
    {
      "list": [
        "2010-12-17 CNK가 카메룬 요카도우마 지역 236㎢ 다이아몬드 광산을 25년간 개발할 권리를 땄다고 공시했다고 보도됐습니다. 같은 날 외교통상부 보도자료에는 최소 4억2천만 캐럿 매장량이 적혔습니다.",
        "2012-01-18 증권선물위원회가 불공정거래 혐의로 임직원을 검찰에 고발할 것으로 보인다는 보도가 나왔습니다.",
        "2013-02-19 검찰은 매장량 수치가 객관적 탐사 결과가 아니라 CNK가 임의로 추린 것이라고 봤다고 보도됐습니다. 이때 오 대표는 기소중지됐습니다.",
        "2016-02-03 서울고법(2015노548)이 1심 무죄였던 사기적 부정거래 부분을 유죄로 바꿨습니다.",
        "2017-06-08 대법원이 상고를 모두 기각했습니다."
      ]
    },
    {
      "p": "2010-12-17 공시와 보도자료의 차이는 프레시안·서울신문 보도로 확인했고, 공시 원문은 열어 보지 못했습니다.",
      "sourceIds": ["news-pressian-37941", "news-seoul-20130219"]
    },
    { "h": "계산하지 않은 것" },
    {
      "p": "검찰이 제시한 약 900억원 부당이득은 법원이 인정하지 않은 금액이라 피해액이나 이익으로 쓰지 않았습니다. 주가 상승폭도 보도 수치이며 손실액이 아닙니다.",
      "sourceIds": ["official-lawgo-195472", "news-seoul-20130219"]
    }
  ],
  "rebuttal": [],
  "sources": [
    { "id": "official-lawgo-195472", "kind": "official", "publisher": "국가법령정보센터(대법원 판례)", "title": "대법원 2017. 6. 8. 선고 2016도3411 판결", "url": "https://www.law.go.kr/LSW/precInfoP.do?precSeq=195472", "publishedAt": "2017-06-08", "accessedAt": "2026-10-21" },
    { "id": "news-lawtimes-118685", "kind": "news", "publisher": "법률신문", "title": "[판결] 다이아몬드 매장량 속여 주가조작… 오덕균 전 CNK 대표, 징역형 확정", "url": "https://www.lawtimes.co.kr/news/articleView.html?idxno=118685", "publishedAt": "2017-06-08", "accessedAt": "2026-10-21" },
    { "id": "news-seoul-20130219", "kind": "news", "publisher": "서울신문", "title": "檢, CNK 다이아몬드 스캔들 ‘대국민 사기극’ 결론", "url": "https://m.seoul.co.kr/news/2013/02/19/20130219800140", "publishedAt": "2013-02-19", "accessedAt": "2026-10-21" },
    { "id": "news-pressian-37941", "kind": "news", "publisher": "프레시안", "title": "정부, 카메룬 다이아 테마로 주가 조작", "url": "https://www.pressian.com/pages/articles/37941", "publishedAt": "2012-01-18", "accessedAt": "2026-10-21" }
  ],
  "related": [],
  "flaggedAt": "2026-10-21",
  "resolvedAt": "2017-06-08",
  "updatedAt": "2026-10-21T00:00:00+09:00",
  "origin": "seed",
  "locked": false
}
