{
  "schemaVersion": 1,
  "id": "sillajen-pexavec-sale-2019",
  "subject": "신라젠",
  "instruments": [{ "code": "215600", "name": "신라젠" }],
  "aliases": ["신현필", "펙사벡"],
  "topics": ["펙사벡", "임상 3상", "미공개 중요정보", "미공개정보", "손실 회피", "무죄 확정", "2022도2706"],
  "speaker": "신현필 전 신라젠 대표 (2020년 1심 보도 당시 직함 전무, 검찰 공소 기준)",
  "audience": "임상 중단 공시 전 신라젠 주식을 사고판 투자자",
  "title": "신라젠 임원 임상 악재 전 매도 무죄 확정",
  "headline": [
    "대법원은 펙사벡 임상 악재를 미리 알고 주식을 팔았다는 혐의를 받은 신현필 전 신라젠 대표의 무죄를 2022년 7월 14일 확정했습니다.",
    "1·2심은 부정적 임상 정보가 만들어졌거나 그에게 전달됐다는 증명이 없다고 봤고, 매도 방식도 사전 인지와 맞지 않는다고 봤습니다."
  ],
  "status": "refuted",
  "resolution": {
    "sourceId": "official-scourt-4602",
    "at": "2022-08-05",
    "note": "대법원 2022-07-14 선고 2022도2706 상고기각으로 미공개 중요정보 이용 혐의 무죄 확정. 대법원 홈페이지 게시일이 2022-08-05이다."
  },
  "behaviors": [
    {
      "type": "concealed",
      "verdict": "refuted",
      "basis": "검찰은 펙사벡 간암 임상 3상 결과가 부정적이라는 미공개 정보를 알고 2019년 6~7월 주식을 팔아 약 64억원 손실을 피했다고 봤습니다. 법원은 세 심급 모두 범죄의 증명이 없다고 봤고, 대법원은 '미공개 중요정보' 법리 오해가 없다며 상고를 기각했습니다.",
      "sourceIds": ["official-scourt-4602", "news-segye-20220802", "news-newstomato-1104770"]
    }
  ],
  "contrast": {
    "before": {
      "label": "검찰 공소",
      "text": "2019년 4월 임상 중간 결과를 알게 된 뒤 6월부터 보유 주식을 팔아 약 64억원의 손실을 피했다고 봤습니다.",
      "sourceId": "news-dailypharm-56059"
    },
    "after": {
      "label": "대법원 판결 (2022-07-14)",
      "text": "공소사실에 범죄의 증명이 없다고 본 원심에 자본시장법 제174조 제1항의 '미공개 중요정보' 법리 오해가 없다며 상고를 기각했습니다.",
      "sourceId": "official-scourt-4602"
    }
  },
  "levels": { "behavior": "refuted", "intent": "refuted", "harm": "insufficient", "legal": "refuted" },
  "legalStatus": "대법원 상고기각으로 무죄 확정(2022-07-14 선고, 2022도2706)",
  "ach": {
    "best": "H0",
    "strongestCounter": "임상 중단 발표(2019-08) 전인 2019년 6~7월에 보유 주식 전량을 팔았다는 시점의 일치가 남습니다. 다만 법원은 시점만으로 사전 인지를 인정하지 않았습니다.",
    "decisiveEvidence": "2019년 3~4월 임상 분석 자료가 부정적 결과를 담았다는 원문, 미국 측 직원에게서 신 전 대표로 정보가 전달된 통신 기록. 법원은 둘 다 확인되지 않았다고 봤습니다."
  },
  "impact": 35,
  "impactReason": "악재 공시 전 임원 매도만으로 사전 인지를 단정하지 않는 기준 사례입니다. 무죄 확정 사건이라 조사 우선순위는 낮습니다.",
  "cover": "https://i.ytimg.com/vi/mwLAvq76sw4/hqdefault.jpg",
  "video": {"youtube": "mwLAvq76sw4", "title": "'악재 공시 전에 주식 매도' 신라젠 전 대표 무죄 / 연합뉴스TV (YonhapnewsTV)"},
  "body": [
    { "h": "무엇이 무죄인지" },
    {
      "p": "신현필 전 대표가 받은 자본시장법 위반(미공개 중요정보 이용) 혐의가 무죄로 확정됐습니다. 검찰은 펙사벡 간암 임상 3상 결과가 부정적이라는 사실을 미리 알고 2019년 6~7월 보유 주식 16만7777주를 약 88억원에 팔아 약 64억원 손실을 피했다고 봤습니다. 매도 주식 수와 금액은 보도마다 16만주·87억원으로도 적혀 있습니다.",
      "sourceIds": ["news-newstomato-1104770", "news-segye-20220802", "news-dailypharm-56059"]
    },
    {
      "p": "1심은 2019년 3~4월에 만들어진 문서만으로 중간 결과가 부정적일 것이라는 정보가 생성됐다고 보기 어렵고, 신 전 대표가 그 정보를 받았다는 증거도 부족하다고 봤습니다. 항소심은 임상 실패를 미리 알았다면 스톡옵션을 서둘러 행사해 팔았을 텐데 그러지 않았고 한 번에 전량을 팔지도 않았다는 점, 미국 직원과의 통신에서 정보 전달을 뒷받침하는 사실이 확인되지 않은 점을 들었습니다.",
      "sourceIds": ["news-dailypharm-56059", "news-newstomato-1104770"]
    },
    {
      "p": "이 판단은 신현필 전 대표의 2019년 매도에 대한 미공개 중요정보 이용 혐의에만 해당합니다. 신라젠의 다른 시기·다른 피고인 사건의 판단으로 옮겨 쓰지 않습니다."
    },
    { "h": "확인한 순서" },
    {
      "list": [
        "2019-04 검찰은 이때 임상 중간 결과를 알았다고 봤습니다.",
        "2019-06~07 보유 주식을 팔았습니다.",
        "2019-08 회사가 임상 중단을 발표했습니다.",
        "2020-12-18 서울남부지법 형사12부가 무죄를 선고했습니다.",
        "2022-02-08 서울고법 형사3부(2021노71)가 검찰 항소를 기각했습니다.",
        "2022-07-14 대법원 1부(2022도2706)가 상고를 기각해 무죄가 확정됐습니다. 세계일보는 2022-08-02에 확정 사실을 보도했습니다."
      ]
    }
  ],
  "rebuttal": [],
  "sources": [
    { "id": "official-scourt-4602", "kind": "official", "publisher": "대법원", "title": "'미공개 정보 이용 혐의' 신라젠 임원, 무죄 확정 (2022도2706 판결문 첨부)", "url": "https://www.scourt.go.kr/portal/news/NewsViewAction.work?seqnum=4602&gubun=2&searchOption=&searchWord=", "publishedAt": "2022-08-05", "accessedAt": "2026-10-21" },
    { "id": "news-segye-20220802", "kind": "news", "publisher": "세계일보", "title": "'악재 공시 전 매도' 신라젠 前 대표 무죄 확정", "url": "https://www.segye.com/newsView/20220802520121", "publishedAt": "2022-08-02", "accessedAt": "2026-10-21" },
    { "id": "news-newstomato-1104770", "kind": "news", "publisher": "뉴스토마토", "title": "'미공개 정보 이용 혐의' 신라젠 전 대표, 2심도 '무죄'", "url": "https://newstomato.com/ReadNews.aspx?no=1104770", "publishedAt": "2022-02-08", "accessedAt": "2026-10-21" },
    { "id": "news-dailypharm-56059", "kind": "news", "publisher": "데일리팜", "title": "'악재 공시 전 주식매도' 혐의 신라젠 임원 1심 무죄", "url": "https://www.dailypharm.com/user/news/56059", "publishedAt": "2020-12-18", "accessedAt": "2026-10-21" }
  ],
  "related": [],
  "flaggedAt": "2026-10-21",
  "resolvedAt": "2022-08-05",
  "updatedAt": "2026-10-21T00:00:00+09:00",
  "origin": "seed",
  "locked": false
}
