{
  "schemaVersion": 1,
  "id": "samchundang-us-exclusive-2026",
  "subject": "삼천당제약",
  "instruments": [{ "code": "000250", "name": "삼천당제약" }],
  "aliases": ["전인석"],
  "topics": ["독점 계약", "비독점", "Exclusive Supply and Sales Agreement", "라이선스 계약", "경구용 세마글루타이드", "리벨서스 제네릭", "위고비 오럴 제네릭", "미국 파트너사", "블록딜 철회"],
  "speaker": "삼천당제약 (2026-03-30 회사 발표)",
  "audience": "투자자와 언론",
  "title": "삼천당제약, 미국 계약 독점 발표와 공시 차이",
  "headline": [
    "삼천당제약은 2026년 3월 30일 미국 파트너사와 경구용 세마글루타이드 독점 계약을 맺었다고 설명했지만, 같은 날 공시는 라이선스 계약이었습니다.",
    "거래소 관계자는 계약서를 검토해 비독점 라이선스로 정리했다고 말했고, 회사는 계약서 제목이 'Exclusive Supply and Sales Agreement'라고 반박했습니다."
  ],
  "status": "pending",
  "behaviors": [
    {
      "type": "concealed",
      "verdict": "suspected",
      "basis": "맞는 말로 틀린 인상을 줄 수 있는 경우입니다. 계약서 제목에 'Exclusive'가 있다는 것은 회사와 거래소 모두 인정합니다. 거래소는 독점 계약이 아니라고 판단했습니다. 독점의 범위(지역·제품·누구에 대한 독점인지)는 계약서 전문이 공개되지 않아 확인하지 못했습니다.",
      "sourceIds": ["news-edaily-20260402", "news-fnnews-20260330"]
    }
  ],
  "contrast": {
    "before": {
      "label": "회사 설명 보도 (2026-03-30)",
      "text": "삼천당제약은 미국 파트너사와 독점 계약 체결을 통해 마일스톤 약 1억 달러(약 1509억 원)를 확보했다고 설명했습니다.",
      "sourceId": "news-fnnews-20260330"
    },
    "after": {
      "label": "한국거래소 관계자 (2026-04-02 보도)",
      "text": "제출 자료의 제목과 내용에 'Exclusive' 표현이 일부 있었지만 독점 계약은 아닌 것으로 판단했고, 회사가 원하는 방식대로 공시하면 과장될 우려가 있어 비독점 라이선스 계약으로 정리했다고 말했습니다.",
      "sourceId": "news-edaily-20260402"
    }
  },
  "levels": { "behavior": "suspected", "intent": "insufficient", "harm": "insufficient", "legal": "insufficient" },
  "legalStatus": "거래소의 계약 해석 취재만 확인. 이 계약 표현에 대한 공식 제재·법원 판단은 미확인",
  "ach": {
    "best": "undecided",
    "strongestCounter": "회사는 계약서 제목이 'Exclusive Supply and Sales Agreement'이고 미국 파트너사 외 다른 기업에는 제품을 공급할 수 없다고 했습니다. 판매 상대가 하나라는 뜻의 독점이면 회사 표현이 틀렸다고 할 수 없습니다.",
    "decisiveEvidence": "계약서 전문의 독점 조항(지역·제품·조건), 거래소 공시 심사 기록, 미국 파트너사의 실체와 판매 권한."
  },
  "beneficiary": "최대주주 전인석 대표이사가 26만5700주(약 2500억원 규모) 블록딜 처분을 공시했다가 2026-04-06 철회했습니다. 이 블록딜로 실현된 매각은 확인되지 않습니다.",
  "impact": 60,
  "impactReason": "미국 시장 독점 여부는 계약 가치 평가의 핵심입니다. 같은 시기 최대주주가 약 2500억원 규모 지분 처분을 공시했다가 4월 6일 철회했습니다.",
  "cover": "https://i.ytimg.com/vi/zqhpYLKT-gA/hqdefault.jpg",
  "video": {"youtube": "zqhpYLKT-gA", "title": "블록딜 철회했지만…삼천당제약, 신뢰 회복 미지수 / 연합뉴스TV (YonhapnewsTV)"},
  "body": [
    { "h": "계약서 제목과 공시 형식이 다르게 읽힙니다" },
    {
      "p": "삼천당제약은 3월 30일 공시로 리벨서스 제네릭과 위고비 먹는약 제네릭의 미국 라이선스 계약을 알렸습니다. 같은 날 회사 설명을 담은 보도는 '독점 계약'을 앞세웠습니다. 이데일리는 회사 보도자료가 독점 계약을 강조했지만 공시 본문에는 '독점 계약' 문구가 없었다고 전했습니다. 거래소 관계자는 계약서와 공시를 검토해 비독점으로 판단했다고 말했습니다.",
      "sourceIds": ["news-hankyung-20260330", "news-fnnews-20260330", "news-edaily-20260402"]
    },
    {
      "p": "회사와 거래소의 차이는 'Exclusive'라는 단어가 무엇을 막는지에 있습니다. 회사는 파트너사 외에는 공급할 수 없다고 말합니다. 거래소는 그것만으로 독점 계약이라 보기 어렵다고 판단했습니다. 계약서 전문이 공개되지 않아 어느 쪽이 맞는지는 확인하지 못했습니다.",
      "sourceIds": ["news-edaily-20260402"]
    },
    { "h": "확인한 순서" },
    {
      "list": [
        "2026-03-30 공시: 미국 라이선스 계약. 상대방은 공개하지 않았고, 순이익을 첫 판매일부터 10년간 9:1(삼천당제약 90%)로 나눕니다.",
        "2026-03-30 회사 설명 보도: 미국 파트너사와 독점 계약, 마일스톤 약 1억 달러 확보.",
        "2026-04-02 이데일리: 거래소는 비독점으로 판단했고, 파트너사는 일반적으로 알려진 기업이 아닌 것으로 보인다고 말했습니다.",
        "2026-04-06 전인석 대표가 기자간담회에서 증여세 납부 목적의 블록딜을 철회했다고 밝혔습니다."
      ]
    }
  ],
  "rebuttal": [
    {
      "label": "삼천당제약 (2026-04-02 보도)",
      "text": "계약서 제목은 'Exclusive Supply and Sales Agreement'이지만 공시 규정상 라이선스 계약으로 표현할 수밖에 없었고, 미국 파트너사 외 다른 기업에는 제품을 공급할 수 없다고 밝혔습니다.",
      "sourceId": "news-edaily-20260402"
    }
  ],
  "sources": [
    { "id": "news-edaily-20260402", "kind": "news", "publisher": "팜이데일리", "title": "'15조 확신' 삼천당 美 계약…거래소, 비독점 판단·검증 불가 [삼천당제약 대해부③]", "url": "https://pharm.edaily.co.kr/news/read?newsId=04073766645412184", "publishedAt": "2026-04-02", "accessedAt": "2026-10-21" },
    { "id": "news-fnnews-20260330", "kind": "news", "publisher": "파이낸셜뉴스 (다음 뉴스 전재)", "title": "삼천당제약, 美 '경구용 GLP-1' 독점 계약…'순이익 9:1배분'", "url": "https://v.daum.net/v/20260330163728736", "publishedAt": "2026-03-30", "accessedAt": "2026-10-21" },
    { "id": "news-hankyung-20260330", "kind": "news", "publisher": "한국경제", "title": "삼천당제약, 먹는 비만약 제네릭 美 라이선스 계약 체결", "url": "https://www.hankyung.com/amp/202603306612i", "publishedAt": "2026-03-30", "accessedAt": "2026-10-21" },
    { "id": "news-mtn-20260406", "kind": "news", "publisher": "머니투데이방송", "title": "기자간담회 진행자 이름도 '기밀' 삼천당제약", "url": "https://news.mtn.co.kr/news-detail/2026040617132655099", "publishedAt": "2026-04-06", "accessedAt": "2026-10-21" },
    { "id": "news-khan-20260411", "kind": "news", "publisher": "경향신문", "title": "“천당에서 지옥으로”…잘 나가던 코스닥 발목 잡은 ‘삼천당 쇼크’", "url": "https://www.khan.co.kr/article/202604110700001/", "publishedAt": "2026-04-11", "accessedAt": "2026-10-21" }
  ],
  "related": [],
  "flaggedAt": "2026-10-21",
  "updatedAt": "2026-10-21T00:00:00+09:00",
  "origin": "seed",
  "locked": false
}
