{
  "schemaVersion": 1,
  "id": "cmotech-offering-2011",
  "subject": "씨모텍",
  "instruments": [{ "code": "081090", "name": "씨모텍" }],
  "aliases": ["나무이쿼티", "C-Motech"],
  "topics": ["나무이쿼티", "증권신고서", "투자설명서", "인수인의 의견", "증권집단소송", "증권관련집단소송", "유상증자", "동부증권"],
  "speaker": "씨모텍 유상증자 대표주관회사 겸 증권인수인 디비금융투자(옛 동부증권)",
  "audience": "2011년 1월 씨모텍 유상증자에 참여해 신주를 산 투자자",
  "title": "씨모텍 증권신고서 최대주주 자본금 허위 기재",
  "headline": [
    "대법원은 씨모텍 유상증자 증권신고서·투자설명서의 인수인 의견에 최대주주 자본금 전환을 사실과 다르게 적은 것을 거짓 기재로 본 원심을 확정했습니다.",
    "나무이쿼티가 인수 차입금 270억원 중 220억원을 자본금으로 바꿨다고 적었지만, 실제 자본금 변동은 없었다고 법원은 인정했습니다."
  ],
  "status": "confirmed",
  "resolution": {
    "sourceId": "official-lawgo-226145",
    "at": "2020-02-27",
    "note": "대법원 2019다223747 증권관련집단소송 상고기각. 증권신고서 등 중요사항 거짓 기재와 인수인 배상책임 확정, 책임은 원심 비율대로 제한."
  },
  "behaviors": [
    {
      "type": "fabricated",
      "verdict": "confirmed",
      "basis": "원심은 증권신고서(2010-09-28)와 투자설명서(2010-12-07)의 인수인의 의견에 나무이쿼티 차입금 270억원 중 220억원이 2010-09-14 기준 자본금으로 전환됐다고 적었으나 실제 자본금 변동이 없었다고 인정했고, 대법원이 유지했습니다. 인수인의 고의는 판단 대상이 아니었습니다.",
      "sourceIds": ["official-lawgo-226145"]
    }
  ],
  "contrast": {
    "before": {
      "label": "증권신고서 인수인의 의견 (2010-09-28)",
      "text": "주식회사 나무이쿼티가 씨모텍을 인수하기 위하여 차입한 270억 원 중 220억 원이 2010. 9. 14. 기준 자본금으로 전환되었다고 적었습니다.",
      "sourceId": "official-lawgo-226145"
    },
    "after": {
      "label": "대법원 판결 (2020-02-27)",
      "text": "나무이쿼티의 자본금 변동이 실제로 없었으므로 중요사항에 관한 거짓 기재라는 원심 판단을 확정했습니다.",
      "sourceId": "official-lawgo-226145"
    }
  },
  "levels": { "behavior": "confirmed", "intent": "insufficient", "harm": "confirmed", "legal": "confirmed" },
  "legalStatus": "증권관련집단소송 대법원 상고기각 확정(2020-02-27, 2019다223747). 관련 형사 판결 원문은 미확인",
  "ach": {
    "best": "H1",
    "strongestCounter": "이 판결은 인수인이 합리적으로 기대되는 조사를 했다는 증명이 없다고 보아 면책을 배척한 민사 판단입니다. 인수인이 거짓을 알고 적었는지, 회사·최대주주가 준 자료를 옮겼는지는 판단하지 않았습니다.",
    "decisiveEvidence": "인수인 실사 자료와 나무이쿼티 측이 제공한 자본금 관련 자료, 나무이쿼티 관계자에 대한 형사 판결 원문"
  },
  "beneficiary": "보도에 따르면 원고 186명에게 14억5000여만원 지급이 확정됐고 판결 효력은 4,972명에게 미칩니다. 책임 비율은 10%로 제한됐습니다.",
  "impact": 55,
  "impactReason": "증자 두 달 뒤 의견거절과 매매거래정지로 증자 참여자 손실이 커졌다는 보도가 있으며, 증권집단소송 첫 대법원 판단입니다.",
  "cover": null,
  "video": null,
  "body": [
    { "h": "쟁점은 최대주주의 인수 자금 구조를 어떻게 적었는가입니다" },
    {
      "p": "씨모텍은 2011년 1월 28일 주주배정 후 실권주 일반공모로 12,000,000주, 286억8000만원을 증자했습니다. 법원은 증권신고서와 투자설명서의 인수인의 의견에 최대주주 나무이쿼티의 차입금이 자본금으로 전환됐다고 적은 부분을 거짓 기재로 봤습니다. 차입으로 인수한 최대주주가 자본을 확충했다는 인상은 증자 참여 판단에 쓰이는 정보입니다.",
      "sourceIds": ["official-lawgo-226145"]
    },
    { "h": "확인한 순서" },
    {
      "list": [
        "2010-02 김모 대표가 최대주주 나무이쿼티를 통해 지분과 경영권을 인수하며 경영에 참여했다고 보도됐습니다.",
        "2010-09-28 증권신고서, 2010-12-07 투자설명서에 문제의 인수인 의견이 들어갔습니다.",
        "2011-01-28 유상증자로 신주 12,000,000주를 발행했습니다.",
        "2011-03-24 한국거래소가 매매거래를 정지했습니다. 증자 두 달 뒤 감사의견 의견거절을 받았다고 보도됐습니다.",
        "2019-02-15 서울고법(2018나2045009)이 인수인의 배상책임을 인정하고 책임을 제한했습니다.",
        "2020-02-27 대법원이 양측 상고를 모두 기각했습니다."
      ]
    },
    {
      "p": "경영권 인수 시점, 증자 목적(LTE 등 연구개발), 거래정지일과 의견거절은 머니투데이 2011-03-27 보도로 확인했습니다.",
      "sourceIds": ["news-mt-2011032716182019642"]
    },
    {
      "p": "증권집단소송 피고는 당시 동부증권으로 보도됐고, 대법원 판결문의 피고는 디비금융투자입니다. 원고는 이모씨 등 186명이고 판결 효력은 4,972명에게 미친다고 보도됐습니다.",
      "sourceIds": ["news-etoday-1444036", "official-lawgo-226145", "news-asiae-2020022715045741151"]
    },
    { "h": "다루지 않은 것" },
    {
      "p": "증자액 286억8000만원은 피해액이 아닙니다. 배상액은 원심이 정한 비율(보도상 10%)로 책임을 제한한 금액입니다. 나무이쿼티 관계자의 형사 판결, 제이콤 증자와 자금 사용처는 원문을 확인하지 못해 이 사건에 넣지 않았습니다.",
      "sourceIds": ["official-lawgo-226145", "news-asiae-2020022715045741151"]
    }
  ],
  "rebuttal": [],
  "sources": [
    { "id": "official-lawgo-226145", "kind": "official", "publisher": "국가법령정보센터(대법원 판례)", "title": "대법원 2020. 2. 27. 선고 2019다223747 판결 (증권관련집단소송)", "url": "https://www.law.go.kr/LSW/precInfoP.do?precSeq=226145", "publishedAt": "2020-02-27", "accessedAt": "2026-10-21" },
    { "id": "news-asiae-2020022715045741151", "kind": "news", "publisher": "아시아경제", "title": "대법, 증권집단소송 첫 판단…씨모텍 소액주주들 최종 승소", "url": "https://www.asiae.co.kr/article/2020022715045741151", "publishedAt": "2020-02-27", "accessedAt": "2026-10-21" },
    { "id": "news-mt-2011032716182019642", "kind": "news", "publisher": "머니투데이", "title": "한 CEO의 극단적 선택...'살얼음 코스닥'", "url": "https://www.mt.co.kr/stock/2011/03/27/2011032716182019642", "publishedAt": "2011-03-27", "accessedAt": "2026-10-21" },
    { "id": "news-etoday-1444036", "kind": "news", "publisher": "이투데이", "title": "증권집단소송, 12년 만에 첫 판결… 진행 중인 사건은", "url": "https://www.etoday.co.kr/news/view/1444036", "publishedAt": "2017-01-19", "accessedAt": "2026-10-21" }
  ],
  "related": [],
  "flaggedAt": "2026-10-21",
  "resolvedAt": "2020-02-27",
  "updatedAt": "2026-10-21T00:00:00+09:00",
  "origin": "seed",
  "locked": false
}
